{"type":"config","name":"Improving sgrep local semantic search quality","metricName":"quality_mrr","metricUnit":"","bestDirection":"higher"}
{"run":1,"commit":"5e58a91","metric":56,"metrics":{},"status":"checks_failed","description":"Baseline: added quality benchmark harness for search MRR on the sgrep repo; benchmark scored 56.00 but cargo test failed during checks (needs triage before keeping any code changes).","timestamp":1773675471698,"segment":0}
{"run":2,"commit":"98e98a0","metric":55.3333,"metrics":{},"status":"keep","description":"Establish first checks-passing baseline for the new search-quality benchmark harness (quality_mrr 55.33; prior 56.00 run had failed checks and was not a valid baseline).","timestamp":1773675520032,"segment":0}
{"type":"config","name":"Improving sgrep local semantic search quality (corrected benchmark scope)","metricName":"quality_mrr","metricUnit":"","bestDirection":"higher"}
{"run":4,"commit":"c174f80","metric":72.5,"metrics":{},"status":"checks_failed","description":"Gated PRF off for precise identifier/path-like queries to reduce query drift. Quality improved to 72.50, but checks failed quickly afterward (likely fmt/clippy), so fix and rerun.","timestamp":1773676557700,"segment":0}
{"run":5,"commit":"f372846","metric":72.5,"metrics":{},"status":"keep","description":"Gate pseudo-relevance feedback off for precise identifier/path-like queries to reduce query drift on targeted code-search questions.","timestamp":1773676623174,"segment":0}
{"run":6,"commit":"f372846","metric":75.3333,"metrics":{},"status":"checks_failed","description":"Added query-intent-aware file-type prioritization only (no score-mix changes): code-seeking queries penalize tests/docs more, docs-seeking queries boost documentation. Quality improved to 75.33 but checks failed quickly afterward (likely fmt), so fix and rerun.","timestamp":1773676790833,"segment":0}
{"run":9,"commit":"e6f3200","metric":76,"metrics":{},"status":"checks_failed","description":"Filtered generic action words out of BM25/BM25F query tokenization so lexical scoring focuses on informative terms. Quality improved to 76.00, but checks failed quickly afterward (likely fmt), so fix and rerun.","timestamp":1773677128004,"segment":0}
{"run":10,"commit":"8e80150","metric":76,"metrics":{},"status":"keep","description":"Filter generic action words out of BM25/BM25F query tokenization so lexical ranking focuses on informative query terms.","timestamp":1773677197544,"segment":0}
{"run":11,"commit":"8e80150","metric":77.3333,"metrics":{},"status":"checks_failed","description":"Broaden PRF gating so specific locator-style queries (where is/where are/which file/document with a small keyword set) skip query expansion and avoid drift. Quality improved to 77.33, but checks failed quickly afterward (likely fmt), so fix and rerun.","timestamp":1773677333008,"segment":0}
{"run":12,"commit":"e55ca0b","metric":79.3333,"metrics":{},"status":"keep","description":"Broaden PRF gating so specific locator-style queries (where is/where are/which file/document with a small keyword set) skip query expansion and avoid drift.","timestamp":1773677403583,"segment":0}
{"run":13,"commit":"e55ca0b","metric":79.3333,"metrics":{},"status":"discard","description":"Resume baseline rerun on the current best commit to confirm stability; quality_mrr matched 79.33 exactly, so discard as unchanged.","timestamp":1773677481844,"segment":0}
{"run":14,"commit":"e55ca0b","metric":79.3333,"metrics":{},"status":"checks_failed","description":"Replaced hardcoded string-based query heuristics with candidate-driven file-type intent inference and generic PRF gating. Metric held at 79.33 before checks, but quick post-run check failure needs cleanup.","timestamp":1773677798362,"segment":0}
{"run":15,"commit":"c5441e4","metric":79.3333,"metrics":{},"status":"keep","description":"Replace hardcoded string-based search intent heuristics with candidate-driven file-type intent inference and generic PRF gating based on query structure plus ranking confidence; primary metric held at 79.33 while making behavior less benchmark-brittle and more repo-agnostic.","timestamp":1773677902677,"segment":0}
{"run":16,"commit":"c5441e4","metric":75.8333,"metrics":{},"status":"discard","description":"Tried a small generic path-term overlap bonus using informative query terms against filename/parent-dir tokens. It hurt docs and overall ranking (quality_mrr 75.83), so discard.","timestamp":1773678140658,"segment":0}
{"run":17,"commit":"c5441e4","metric":75.8333,"metrics":{},"status":"discard","description":"Tried adding a file-evidence bonus from the second-best chunk in the same file so multi-section modules could outrank one-off hits. It regressed to 75.83 and hurt docs, so discard.","timestamp":1773678403298,"segment":0}
{"run":18,"commit":"c5441e4","metric":77.1667,"metrics":{},"status":"discard","description":"Tried attaching leading adjacent comment blocks to semantic chunks so module docs and API comments participate in retrieval. It improved some config-style queries but regressed overall to 77.17, so discard.","timestamp":1773678539365,"segment":0}
{"run":19,"commit":"c5441e4","metric":77.3333,"metrics":{},"status":"discard","description":"Tried query-adaptive fusion weights that gave more BM25 weight to compact precise-looking queries using structural signals (uppercase/digits/markers). It over-shifted toward lexical matches, perfecting docs but hurting code retrieval and overall MRR, so discard.","timestamp":1773678990734,"segment":0}
{"run":20,"commit":"c5441e4","metric":79.3333,"metrics":{},"status":"discard","description":"Raised BM25F symbol-field term frequency boost from 2 to 3 so identifier/symbol matches carry more lexical weight. Primary metric stayed flat at 79.33 with no broad quality gain, so discard as unchanged.","timestamp":1773679085690,"segment":0}
{"run":21,"commit":"c5441e4","metric":77.1111,"metrics":{},"status":"discard","description":"Tried expanding BM25 tokenization to emit identifier subwords from snake_case and CamelCase so code symbols are matchable by component terms. It improved some exact code-term ranking but regressed docs and latency badly overall, so discard.","timestamp":1773679384746,"segment":0}
{"run":22,"commit":"c5441e4","metric":79.3333,"metrics":{},"status":"discard","description":"Tried a larger internal rerank window (up to 3x the output limit, capped at 50) so PRF, file-type priority, and ANN shortlists operate on more candidates before truncation. Primary quality stayed flat at 79.33 while median latency worsened, so discard.","timestamp":1773679597874,"segment":0}
{"run":23,"commit":"a04f517","metric":81.3333,"metrics":{},"status":"keep","description":"Split identifiers only in high-signal BM25F fields (filename, path, and extracted symbols), while leaving full content tokenization unchanged. This preserves general semantic behavior but makes module and API names like JsonResponse/Bm25FIndex more discoverable, improving quality_mrr to 81.33.","timestamp":1773679913332,"segment":0}
{"run":24,"commit":"a04f517","metric":79.8333,"metrics":{},"status":"discard","description":"Tried attaching a small set of top-level file symbols to every chunk's BM25F symbol field so file-discovery queries could inherit module vocabulary across chunks. It helped some code queries but hurt docs and regressed overall from 81.33 to 79.83, so discard.","timestamp":1773680143342,"segment":0}
{"run":25,"commit":"9dd3c1c","metric":82,"metrics":{},"status":"keep","description":"Added a small graph-aware bonus for chunks whose own extracted symbol identifiers overlap the query's informative terms. This keeps the signal local to the chunk, avoids copying file-wide symbols everywhere, and improves code-focused module discovery to quality_mrr 82.00.","timestamp":1773680438541,"segment":0}
{"run":26,"commit":"faf7183","metric":84,"metrics":{},"status":"keep","description":"Expanded lexical query tokens with safe suffix variants for `-ing` and `-ed` words (for example `scoring` -> `score`, `cached` -> `cache`) while keeping PRF compactness decisions on the base token set. This improves exact lexical recall without brittle query strings and raises quality_mrr to 84.00.","timestamp":1773680793748,"segment":0}
{"run":27,"commit":"bec24a5","metric":85.3333,"metrics":{},"status":"keep","description":"Added a lexical-confirmation bonus when strong BM25 evidence and chunk-local symbol overlap agree. This selectively boosts exact identifier/module hits without globally reweighting semantic search, improving quality_mrr to 85.33.","timestamp":1773680895191,"segment":0}
{"run":28,"commit":"bec24a5","metric":84.3333,"metrics":{},"status":"discard","description":"Tried adding adjacent-term abbreviation variants to lexical query tokens (for example `memory mapped` -> `mmap`) to help compact identifier queries. It partially rescued `mmap_index` recall but regressed overall quality from 85.33 to 84.33, so discard.","timestamp":1773681001480,"segment":0}
{"run":29,"commit":"6624600","metric":87.3333,"metrics":{},"status":"keep","description":"Added an IDF-weighted high-signal field bonus for rare query terms matched in path and chunk-local symbol identifiers. This strengthens module/file discovery when rare structural terms align without globally changing semantic weights, improving quality_mrr to 87.33.","timestamp":1773681406238,"segment":0}
